ID,front/title,front/icon,front/description,,back/title,back/icon,back/description,,,
chinese-essencial-in-communication-3-thai-station-stop,车站,,chēzhàn,"station, stop",สถานีรถไฟ,🚌,我在**车站**等你。 (Wǒ zài **chēzhàn** děng nǐ.) ฉันจะรอคุณที่**ป้ายรถเมล์**,我在**车站**等你。,Wǒ zài **chēzhàn** děng nǐ.,ฉันจะรอคุณที่**ป้ายรถเมล์**
chinese-essencial-in-communication-3-thai-the-entrance-to-a-hutong,胡同口儿,,hútòng kǒur,the entrance to a hutong,ปากซอย,➡️,我在**胡同口儿**等你。 (wǒ zài **hú tòng kǒu er** děng nǐ.) ฉันจะรอคุณอยู่ที่**ปากซอย**,我在**胡同口儿**等你。,wǒ zài **hú tòng kǒu er** děng nǐ.,ฉันจะรอคุณอยู่ที่**ปากซอย**
chinese-essencial-in-communication-3-thai-hutong-lane-alley,胡同,,hútòng,"hutong, lane, alley",ตรอก,🏘️,北京的**胡同**很有特色。 (Běijīng de **hútòng** hěn yǒu tèsè.) **ตรอก**ซอยในปักกิ่งมีเอกลักษณ์เฉพาะตัว,北京的**胡同**很有特色。,Běijīng de **hútòng** hěn yǒu tèsè.,**ตรอก**ซอยในปักกิ่งมีเอกลักษณ์เฉพาะตัว
chinese-essencial-in-communication-3-thai-downtown,市中心,,shì zhōngxīn,downtown,ใจกลางเมือง,🏙️,我在**市中心**工作。 (Wǒ zài **shì zhōng xīn** gōng zuò.) ฉันทำงานอยู่**ใจกลางเมือง**,我在**市中心**工作。,Wǒ zài **shì zhōng xīn** gōng zuò.,ฉันทำงานอยู่**ใจกลางเมือง**
chinese-essencial-in-communication-3-thai-center,中心,,zhōngxīn,center,ศูนย์กลาง,🎯,购物**中心**离我家很近。 (gòuwù **zhōngxīn** lí wǒ jiā hěn jìn.) ศูนย์การค้าอยู่ใกล้บ้านฉันมาก,购物**中心**离我家很近。,gòuwù **zhōngxīn** lí wǒ jiā hěn jìn.,ศูนย์การค้าอยู่ใกล้บ้านฉันมาก
chinese-essencial-in-communication-3-thai-seem-be-like,好像,,hǎoxiàng,"seem, be like",ดูเหมือนว่า,🧐,你**好像**很高兴。 (nǐ **hǎoxiàng** hěn gāoxìng.) คุณดูมีความสุข**เหมือนจะ**มาก,你**好像**很高兴。,nǐ **hǎoxiàng** hěn gāoxìng.,คุณดูมีความสุข**เหมือนจะ**มาก
chinese-essencial-in-communication-3-thai-green-plot,绿地,,lǜdì,green plot,พื้นที่สีเขียว,🌿,我们公园里有很大的**绿地**。 (Wǒmen gōngyuán lǐ yǒu hěn dà de **lǜdì**.) ในสวนสาธารณะของเรามีพื้นที่**สีเขียว**ขนาดใหญ่,我们公园里有很大的**绿地**。,Wǒmen gōngyuán lǐ yǒu hěn dà de **lǜdì**.,ในสวนสาธารณะของเรามีพื้นที่**สีเขียว**ขนาดใหญ่
chinese-essencial-in-communication-3-thai-garden,花园,,huāyuán,garden,สวน,🌸,我喜欢在**花园**里散步。 (Wǒ xǐhuān zài **huāyuán** lǐ sànbù.) ฉันชอบเดินเล่นใน**สวน**,我喜欢在**花园**里散步。,Wǒ xǐhuān zài **huāyuán** lǐ sànbù.,ฉันชอบเดินเล่นใน**สวน**
chinese-essencial-in-communication-3-thai-of-an-old-couple-husband-or-wife,老伴儿,,lǎobànr,(of an old couple) husband or wife,คู่ชีวิต,👵,我的**老伴儿**喜欢去公园散步。 (Wǒ de **lǎobànr** xǐhuān qù gōngyuán sànbù.) **คู่ชีวิต**ของฉันชอบไปเดินเล่นที่สวนสาธารณะ,我的**老伴儿**喜欢去公园散步。,Wǒ de **lǎobànr** xǐhuān qù gōngyuán sànbù.,**คู่ชีวิต**ของฉันชอบไปเดินเล่นที่สวนสาธารณะ
chinese-essencial-in-communication-3-thai-side,旁边,,pángbiān,side,ข้างๆ,➡️,我的书包在桌子**旁边**。 (wǒ de shūbāo zài zhuōzi **pángbiān**.) กระเป๋าของฉันอยู่**ข้างๆ**โต๊ะ,我的书包在桌子**旁边**。,wǒ de shūbāo zài zhuōzi **pángbiān**.,กระเป๋าของฉันอยู่**ข้างๆ**โต๊ะ
chinese-essencial-in-communication-3-thai-supermarket,超市,,chāoshì,supermarket,ซูเปอร์มาร์เก็ต,🛒,我去**超市**买菜。 (Wǒ qù **chāoshì** mǎi cài.) ฉันไปซื้อกับข้าวที่**ซูเปอร์มาร์เก็ต**,我去**超市**买菜。,Wǒ qù **chāoshì** mǎi cài.,ฉันไปซื้อกับข้าวที่**ซูเปอร์มาร์เก็ต**
chinese-essencial-in-communication-3-thai-restaurant,饭馆儿,,fànguǎnr,restaurant,ร้านอาหาร,🍽️,我们在**饭馆儿**吃饭。 (wǒ men zài **fànguǎnr** chīfàn.) เรากินข้าวที่**ร้านอาหาร**,我们在**饭馆儿**吃饭。,wǒ men zài **fànguǎnr** chīfàn.,เรากินข้าวที่**ร้านอาหาร**
chinese-essencial-in-communication-3-thai-to-taste,尝,,cháng,to taste,ชิม,👅,"你**尝**尝这个菜，很好吃。 (Nǐ **cháng** chang zhège cài, hěn hào chī.) คุณ**ลอง**ชิมอาหารจานนี้ดู อร่อยมาก",你**尝**尝这个菜，很好吃。,"Nǐ **cháng** chang zhège cài, hěn hào chī.",คุณ**ลอง**ชิมอาหารจานนี้ดู อร่อยมาก
chinese-essencial-in-communication-3-thai-house,房子,,fángzi,house,บ้าน,🏠,他買了一棟**房子**。 (Tā mǎile yī dòng **fángzi**.) เขาซื้อ**บ้าน**หนึ่งหลัง,他買了一棟**房子**。,Tā mǎile yī dòng **fángzi**.,เขาซื้อ**บ้าน**หนึ่งหลัง
chinese-essencial-in-communication-3-thai-suburban-district,郊区,,jiāoqū,suburban district,ชานเมือง,🌳,我住在**郊区**。 (Wǒ zhù zài **jiāoqū**.) ฉันอาศัยอยู่ใน**ชานเมือง**,我住在**郊区**。,Wǒ zhù zài **jiāoqū**.,ฉันอาศัยอยู่ใน**ชานเมือง**
chinese-essencial-in-communication-3-thai-beauty-parlor,美容院,,měiróngyuàn,beauty parlor,ร้านเสริมสวย,💅,我想去**美容院**。 (wǒ xiǎng qù **měiróngyuàn**.) ฉันอยากไป**ร้านเสริมสวย**,我想去**美容院**。,wǒ xiǎng qù **měiróngyuàn**.,ฉันอยากไป**ร้านเสริมสวย**
chinese-essencial-in-communication-3-thai-traffic,交通,,jiāotōng,traffic,การจราจร,🚦,北京的**交通**很方便。 (Běijīng de **jiāotōng** hěn fāngbiàn.) การ**คมนาคม**ในปักกิ่งสะดวกมาก,北京的**交通**很方便。,Běijīng de **jiāotōng** hěn fāngbiàn.,การ**คมนาคม**ในปักกิ่งสะดวกมาก
chinese-essencial-in-communication-3-thai-subway-station,地铁站,,dìtiě zhàn,subway station,สถานีรถไฟใต้ดิน,🚇,我在**地铁站**等你。 (Wǒ zài **dìtiězhàn** děng nǐ.) ฉันจะรอคุณที่**สถานีรถไฟใต้ดิน**,我在**地铁站**等你。,Wǒ zài **dìtiězhàn** děng nǐ.,ฉันจะรอคุณที่**สถานีรถไฟใต้ดิน**
chinese-essencial-in-communication-3-thai-town-city,城里,,chénglǐ,"town, city",ในเมือง,📍,我住在**城里**。 (Wǒ zhù zài **chéng lǐ**.) ฉันอาศัยอยู่ใน**เมือง**,我住在**城里**。,Wǒ zhù zài **chéng lǐ**.,ฉันอาศัยอยู่ใน**เมือง**
chinese-essencial-in-communication-3-thai-to-need-to-take,要,,yào,"to need, to take",ต้อง,⏳,我**要**去商店。 (wǒ **yào** qù shāngdiàn.) ฉัน**จะ**ไปร้านค้า,我**要**去商店。,wǒ **yào** qù shāngdiàn.,ฉัน**จะ**ไปร้านค้า
chinese-essencial-in-communication-3-thai-neighbor,邻居,,línjū,neighbor,เพื่อนบ้าน,🧑‍🤝‍🧑,我的**邻居**人很好。 (Wǒ de **línjū** rén hěn hǎo.) **เพื่อนบ้าน**ของฉันใจดีมาก,我的**邻居**人很好。,Wǒ de **línjū** rén hěn hǎo.,**เพื่อนบ้าน**ของฉันใจดีมาก
chinese-essencial-in-communication-3-thai-to-go-back,回,,huí,to go back,กลับ,🔙,我**回**家了。 (wǒ **huí** jiā le.) ฉัน**กลับ**บ้านแล้ว,我**回**家了。,wǒ **huí** jiā le.,ฉัน**กลับ**บ้านแล้ว
chinese-essencial-in-communication-3-thai-post-office,邮局,,yóujú,post office,ไปรษณีย์,📮,我去**邮局**寄信。 (wǒ qù **yóujú** jì xìn.) ฉันไป**ที่ทำการไปรษณีย์**เพื่อส่งจดหมาย,我去**邮局**寄信。,wǒ qù **yóujú** jì xìn.,ฉันไป**ที่ทำการไปรษณีย์**เพื่อส่งจดหมาย
chinese-essencial-in-communication-3-thai-to-fetch,取,,qǔ,to fetch,เอา,📥,我要**取**回我的书。 (Wǒ yào **qǔ** huí wǒ de shū.) ฉันต้องการ**เอา**หนังสือของฉันคืน,我要**取**回我的书。,Wǒ yào **qǔ** huí wǒ de shū.,ฉันต้องการ**เอา**หนังสือของฉันคืน
chinese-essencial-in-communication-3-thai-password,密码,,mìmǎ,password,รหัสผ่าน,🔒,请告诉我你的**密码**。 (Qǐng gào sù wǒ nǐ de **mìmǎ**.) โปรดบอก**รหัสผ่าน**ของคุณให้ฉันทราบ,请告诉我你的**密码**。,Qǐng gào sù wǒ nǐ de **mìmǎ**.,โปรดบอก**รหัสผ่าน**ของคุณให้ฉันทราบ
chinese-essencial-in-communication-3-thai-delivery-locker,快递柜,,kuàidìguì,delivery locker,ตู้รับพัสดุ,📦,包裹在**快递柜**里。 (Bāoguǒ zài **kuàidigùi** lǐ.) พัสดุอยู่ใน**ตู้เก็บของ**,包裹在**快递柜**里。,Bāoguǒ zài **kuàidigùi** lǐ.,พัสดุอยู่ใน**ตู้เก็บของ**
chinese-essencial-in-communication-3-thai-screen,屏幕,,píngmù,screen,หน้าจอ,🖥️,我的手机**屏幕**坏了。 (wǒ de shǒujī **píngmù** huàile.) หน้าจอโทรศัพท์ของฉันเสีย,我的手机**屏幕**坏了。,wǒ de shǒujī **píngmù** huàile.,หน้าจอโทรศัพท์ของฉันเสีย
chinese-essencial-in-communication-3-thai-to-fill-in,填,,tián,to fill in,กรอก,✍️,请**填**写表格。 (qǐng **tián** xiě biǎo gé.) กรุณา**กรอก**แบบฟอร์ม,请**填**写表格。,qǐng **tián** xiě biǎo gé.,กรุณา**กรอก**แบบฟอร์ม
chinese-essencial-in-communication-3-thai-chinese-dumpling,饺子,,jiǎozi,Chinese dumpling,เกี๊ยว,🥟,我喜欢吃**饺子**。 (Wǒ xǐhuān chī **jiǎozi**.) ฉันชอบกิน**เกี๊ยว**,我喜欢吃**饺子**。,Wǒ xǐhuān chī **jiǎozi**.,ฉันชอบกิน**เกี๊ยว**
chinese-essencial-in-communication-3-thai-just,刚,,gāng,just,เพิ่งจะ,⏱️,我**刚**到家。 (wǒ **gāng** dàojiā.) ฉันเพิ่ง**ถึง**บ้าน,我**刚**到家。,wǒ **gāng** dàojiā.,ฉันเพิ่ง**ถึง**บ้าน
chinese-essencial-in-communication-3-thai-relation,关系,,guānxi,relation,ความสัมพันธ์,🤝,今天是**阴天**。 (Jīntiān shì **yīntiān**.) วันนี้เป็นวัน**ท้องฟ้ามืดครึ้ม**,今天是**阴天**。,Jīntiān shì **yīntiān**.,วันนี้เป็นวัน**ท้องฟ้ามืดครึ้ม**
chinese-essencial-in-communication-3-thai-to-visit,看望,,kànwàng,to visit,เยี่ยม,🧑‍🤝‍🧑,我明天会去**看望**我的奶奶。 (Wǒ míngtiān huì qù **kànwàng** wǒ de nǎinai.) พรุ่งนี้ฉันจะไป**เยี่ยม**คุณย่าของฉัน,我明天会去**看望**我的奶奶。,Wǒ míngtiān huì qù **kànwàng** wǒ de nǎinai.,พรุ่งนี้ฉันจะไป**เยี่ยม**คุณย่าของฉัน
chinese-essencial-in-communication-3-thai-courtyard-house,四合院,,Sìhéyuàn,Courtyard house,บ้านจีนโบราณ,🏠,我家住在**四合院**里。 (Wǒ jiā zhù zài **sìhéyuàn** lǐ.) บ้านของฉันอยู่ใน**ซื่อเหอเยวี่ยน**,我家住在**四合院**里。,Wǒ jiā zhù zài **sìhéyuàn** lǐ.,บ้านของฉันอยู่ใน**ซื่อเหอเยวี่ยน**
chinese-essencial-in-communication-3-thai-courtyard,院儿,,yuànr,courtyard,"=AI(""Give the most accurate and common single Thai word or short phrase translation"",B107)",🪴,我们家的后**院儿**很大。 (Wǒmen jiā de hòu**yuànr** hěn dà.) สวนหลังบ้านของเราใหญ่มาก,我们家的后**院儿**很大。,Wǒmen jiā de hòu**yuànr** hěn dà.,สวนหลังบ้านของเราใหญ่มาก
chinese-essencial-in-communication-3-thai-north-facing-house,北房,,běifáng,north-facing house,บ้านทางเหนือ,↖️,我家住在**北房**。 (Wǒ jiā zhù zài **běi fáng**.) บ้านของฉันอยู่ทาง**ทิศเหนือ**,我家住在**北房**。,Wǒ jiā zhù zài **běi fáng**.,บ้านของฉันอยู่ทาง**ทิศเหนือ**
chinese-essencial-in-communication-3-thai-south-facing-house,南房,,nánfáng,south-facing house,ห้องใต้,↙️,我家在**南房**。 (Wǒ jiā zài **nánfáng**.) บ้านของฉันอยู่ทาง**ห้องใต้**,我家在**南房**。,Wǒ jiā zài **nánfáng**.,บ้านของฉันอยู่ทาง**ห้องใต้**
chinese-essencial-in-communication-3-thai-to-go-over,过去,,guòqu,to go over,ที่ผ่านมา,🚶,我**过去**常常去那里。 (Wǒ **guòqù** chángcháng qù nàlǐ.) ฉันเคยไปที่นั่นบ่อยๆ ใน**อดีต**,我**过去**常常去那里。,Wǒ **guòqù** chángcháng qù nàlǐ.,ฉันเคยไปที่นั่นบ่อยๆ ใน**อดีต**
chinese-essencial-in-communication-3-thai-to-post-to-send,寄,,jì,"to post, to send",ส่ง,📧,我把书**寄**给你。 (wǒ bǎ shū **jì** gěi nǐ.) ฉันจะ**ส่ง**หนังสือไปให้คุณ,我把书**寄**给你。,wǒ bǎ shū **jì** gěi nǐ.,ฉันจะ**ส่ง**หนังสือไปให้คุณ
chinese-essencial-in-communication-3-thai-measure-word-for-paper,张,,zhāng,(measure word for paper),ตระกูล,📄,这**张**桌子是我的。 (Zhè **zhāng** zhuōzi shì wǒ de.) โต๊ะตัว**นี้**เป็นของฉัน,这**张**桌子是我的。,Zhè **zhāng** zhuōzi shì wǒ de.,โต๊ะตัว**นี้**เป็นของฉัน
chinese-essencial-in-communication-3-thai-postcard,明信片,,míngxìnpiàn,postcard,โปสการ์ด,🖼️,我寄了一张**明信片**给我的朋友。 (Wǒ jìle yī zhāng **míngxìnpiàn** gěi wǒ de péngyǒu.) ฉันส่ง**ไปรษณียบัตร**ให้เพื่อนของฉัน,我寄了一张**明信片**给我的朋友。,Wǒ jìle yī zhāng **míngxìnpiàn** gěi wǒ de péngyǒu.,ฉันส่ง**ไปรษณียบัตร**ให้เพื่อนของฉัน
chinese-essencial-in-communication-3-thai-letter,信,,xìn,letter,จดหมาย,✉️,今天是**阴天**。 (Jīntiān shì **yīntiān**.) วันนี้เป็น**วันฟ้าครึ้ม**,今天是**阴天**。,Jīntiān shì **yīntiān**.,วันนี้เป็น**วันฟ้าครึ้ม**
chinese-essencial-in-communication-3-thai-water-transport,水路,,shuǐlù,water transport,เส้นทางน้ำ,🚢,这条**水路**很窄。 (Zhè tiáo **shuǐlù** hěn zhǎi.) ทาง**น้ำ**แคบมาก,这条**水路**很窄。,Zhè tiáo **shuǐlù** hěn zhǎi.,ทาง**น้ำ**แคบมาก
chinese-essencial-in-communication-3-thai-air-transport,航空,,hángkōng,air transport,การบิน,✈️,中国**航空**公司很大。 (Zhōngguó **hángkōng** gōngsī hěn dà.) บริษัท **การบิน** ของจีนใหญ่มาก,中国**航空**公司很大。,Zhōngguó **hángkōng** gōngsī hěn dà.,บริษัท **การบิน** ของจีนใหญ่มาก
chinese-essencial-in-communication-3-thai-stamp,邮票,,yóupiào,stamp,แสตมป์,🏷️,我喜欢收集**邮票**。 (Wǒ xǐhuān shōují **yóupiào**.) ฉันชอบสะสม**แสตมป์**,我喜欢收集**邮票**。,Wǒ xǐhuān shōují **yóupiào**.,ฉันชอบสะสม**แสตมป์**
chinese-essencial-in-communication-3-thai-parcel,包裹,,bāoguǒ,parcel,พัสดุ,🎁,这个**包裹**很重。 (Zhège **bāoguǒ** hěn zhòng.) **พัสดุ**นี้หนักมาก,这个**包裹**很重。,Zhège **bāoguǒ** hěn zhòng.,**พัสดุ**นี้หนักมาก
chinese-essencial-in-communication-3-thai-to-need,需要,,xūyào,to need,ต้องการ,🙏,我**需要**去洗手间。 (Wǒ **xūyào** qù xǐshǒujiān.) ฉัน**ต้องการ**ไปห้องน้ำ,我**需要**去洗手间。,Wǒ **xūyào** qù xǐshǒujiān.,ฉัน**ต้องการ**ไปห้องน้ำ
chinese-essencial-in-communication-3-thai-how-long,多长时间,,duō cháng shíjiān,how long,นานแค่ไหน,❓,你学中文**多长时间**了？ (nǐ xué zhōngwén **duō cháng shíjiān** le?) คุณเรียนภาษาจีนมา**นานแค่ไหน**แล้ว?,你学中文**多长时间**了？,nǐ xué zhōngwén **duō cháng shíjiān** le?,คุณเรียนภาษาจีนมา**นานแค่ไหน**แล้ว?
chinese-essencial-in-communication-3-thai-long,长,,cháng,long,ยาว,📏,她有**长**头发。 (Tā yǒu **cháng** tóufa.) เธอมีผม**ยาว**,她有**长**头发。,Tā yǒu **cháng** tóufa.,เธอมีผม**ยาว**
chinese-essencial-in-communication-3-thai-express-delivery,特快专递,,tèkuài zhuǎndì,express delivery,ไปรษณีย์ด่วนพิเศษ,🚀,我需要寄一份**特快专递**到上海。 (wǒ xū yào jì yī fèn **tè kuài zhuān dì** dào shàng hǎi.) ฉันต้องการส่งพัสดุ**ด่วนพิเศษ**ไปเซี่ยงไฮ้,我需要寄一份**特快专递**到上海。,wǒ xū yào jì yī fèn **tè kuài zhuān dì** dào shàng hǎi.,ฉันต้องการส่งพัสดุ**ด่วนพิเศษ**ไปเซี่ยงไฮ้
chinese-essencial-in-communication-3-thai-tea,茶叶,,cháyè,tea,ใบชา,🍵,我喜欢喝**茶叶**。 (wǒ xǐhuan hē **cháyè**.) ฉันชอบดื่ม**ชา**,我喜欢喝**茶叶**。,wǒ xǐhuan hē **cháyè**.,ฉันชอบดื่ม**ชา**
chinese-essencial-in-communication-3-thai-to-weigh,称,,chēng,to weigh,เรียกว่า,⚖️,他**称**赞这道菜很好吃。 (Tā **chēng**zàn zhè dào cài hěn hào chī.) เขา**ชื่นชม**ว่าอาหารจานนี้อร่อยมาก,他**称**赞这道菜很好吃。,Tā **chēng**zàn zhè dào cài hěn hào chī.,เขา**ชื่นชม**ว่าอาหารจานนี้อร่อยมาก
chinese-essencial-in-communication-3-thai-fast-mail,快递,,kuàidì,fast mail,ส่งด่วน,🏍️,我要寄**快递**。 (wǒ yào jì **kuài dì**.) ฉันต้องการส่ง**พัสดุ**ด่วน,我要寄**快递**。,wǒ yào jì **kuài dì**.,ฉันต้องการส่ง**พัสดุ**ด่วน
chinese-essencial-in-communication-3-thai-week,周,,zhōu,week,สัปดาห์,🗓️,今天我**周**游世界。 (Jīntiān wǒ **zhōu**yóu shìjiè.) วันนี้ฉันท่องเที่ยวรอบโลก**_**,今天我**周**游世界。,Jīntiān wǒ **zhōu**yóu shìjiè.,วันนี้ฉันท่องเที่ยวรอบโลก**_**
chinese-essencial-in-communication-3-thai-parcel-form,包裹单,,bāoguǒdān,parcel form,ใบส่งของ,📝,请给我您的**包裹单**。 (Qǐng gěi wǒ nín de **bāoguǒdān**.) โปรดให้ **ใบนำส่งพัสดุ** ของคุณกับฉัน,请给我您的**包裹单**。,Qǐng gěi wǒ nín de **bāoguǒdān**.,โปรดให้ **ใบนำส่งพัสดุ** ของคุณกับฉัน
chinese-essencial-in-communication-3-thai-addressee,收件人,,shōujiànrén,addressee,ผู้รับ,🏷️,请填写**收件人**的地址。 (qǐng tiánxiě **shōujiànrén** de dìzhǐ.) กรุณากรอกที่อยู่ของ**ผู้รับ**,请填写**收件人**的地址。,qǐng tiánxiě **shōujiànrén** de dìzhǐ.,กรุณากรอกที่อยู่ของ**ผู้รับ**
chinese-essencial-in-communication-3-thai-address,地址,,dìzhǐ,address,ที่อยู่,🗺️,我的**地址**是北京路1号。 (wǒ de **dì zhǐ** shì běi jīng lù yī hào.) ที่อยู่ของฉันคือถนนปักกิ่งหมายเลข 1.,我的**地址**是北京路1号。,wǒ de **dì zhǐ** shì běi jīng lù yī hào.,ที่อยู่ของฉันคือถนนปักกิ่งหมายเลข 1.
chinese-essencial-in-communication-3-thai-what-a-coincidence,真巧,,zhēn qiǎo,what a coincidence,บังเอิญ,😮,今天真巧。 (Jīntiān zhēn **qiǎo**.) **วันนี้**บังเอิญจัง,今天真巧。,Jīntiān zhēn **qiǎo**.,**วันนี้**บังเอิญจัง
chinese-essencial-in-communication-3-thai-us-dollar,美元,,Měiyuán,US dollar,ดอลลาร์สหรัฐ,💵,这是**美元**。 (Zhè shì **měiyuán**.) นี่คือ**ดอลลาร์**,这是**美元**。,Zhè shì **měiyuán**.,นี่คือ**ดอลลาร์**
chinese-essencial-in-communication-3-thai-exchange-rate,汇率,,huìlǜ,exchange rate,อัตราแลกเปลี่ยน,💱,今天的**汇率**是多少？ (Jīntiān de **huìlǜ** shì duōshǎo?) วันนี้**อัตราแลกเปลี่ยน**เท่าไหร่?,今天的**汇率**是多少？,Jīntiān de **huìlǜ** shì duōshǎo?,วันนี้**อัตราแลกเปลี่ยน**เท่าไหร่?
chinese-essencial-in-communication-3-thai-to-exchange,换,,huàn,to exchange,เปลี่ยน,↔️,请帮我**换**一下零钱。 (Qǐng bāng wǒ **huàn** yīxià língqián.) กรุณาช่วยฉัน**แลก**เงินหน่อย,请帮我**换**一下零钱。,Qǐng bāng wǒ **huàn** yīxià língqián.,กรุณาช่วยฉัน**แลก**เงินหน่อย
chinese-essencial-in-communication-3-thai-japanese-yen,日元,,Rìyuán,Japanese yen,เยน,💴,我需要把美元换成**日元**。 (Wǒ xūyào bǎ měiyuán huànchéng **rìyuán**.) ฉันต้องการแลกเงินดอลลาร์เป็น**เยน**,我需要把美元换成**日元**。,Wǒ xūyào bǎ měiyuán huànchéng **rìyuán**.,ฉันต้องการแลกเงินดอลลาร์เป็น**เยน**
chinese-essencial-in-communication-3-thai-yesterday,昨天,,zuótiān,yesterday,เมื่อวาน,⏪,我**昨天**去学校了。 (Wǒ **zuótiān** qù xuéxiàole.) ฉันไปโรงเรียนมา**เมื่อวานนี้**,我**昨天**去学校了。,Wǒ **zuótiān** qù xuéxiàole.,ฉันไปโรงเรียนมา**เมื่อวานนี้**
chinese-essencial-in-communication-3-thai-same,一样,,yīyàng,same,เหมือนกัน,👯,你和我长得**一样**。 (Nǐ hé wǒ zhǎng de **yīyàng**.) คุณกับฉันหน้าตา**เหมือนกัน**,你和我长得**一样**。,Nǐ hé wǒ zhǎng de **yīyàng**.,คุณกับฉันหน้าตา**เหมือนกัน**
