ID,front/title,front/icon,front/description,,back/title,back/icon,back/description,,,
chinese-essencial-in-communication-3-thai-department-store,百货商场,,bǎihuò shāngchǎng,department store,ห้างสรรพสินค้า,🛍️,我喜欢去**百货商场**买东西。 (Wǒ xǐhuān qù **bǎihuò shāngchǎng** mǎi dōngxi.) ฉันชอบไปซื้อของที่**ห้างสรรพสินค้า**,我喜欢去**百货商场**买东西。,Wǒ xǐhuān qù **bǎihuò shāngchǎng** mǎi dōngxi.,ฉันชอบไปซื้อของที่**ห้างสรรพสินค้า**
chinese-essencial-in-communication-3-thai-market-mall,商场,,shāngchǎng,"market, mall",ห้างสรรพสินค้า,🏬,我去**商场**买东西。 (Wǒ qù **shāngchǎng** mǎi dōngxi.) ฉันไปซื้อของที่**ห้างสรรพสินค้า**,我去**商场**买东西。,Wǒ qù **shāngchǎng** mǎi dōngxi.,ฉันไปซื้อของที่**ห้างสรรพสินค้า**
chinese-essencial-in-communication-3-thai-clothes-clothing,衣服,,yīfu,"clothes, clothing",เสื้อผ้า,👕,这件**衣服**很漂亮。 (zhè jiàn **yī fú** hěn piào liang.) ชุดนี้สวยมาก,这件**衣服**很漂亮。,zhè jiàn **yī fú** hěn piào liang.,ชุดนี้สวยมาก
chinese-essencial-in-communication-3-thai-franchised-store,专卖店,,zhuānmàidiàn,franchised store,ร้านเฉพาะ,💎,这是一家电器**专卖店**。 (Zhè shì yī jiā diànqì **zhuānmàidiàn**.) นี่คือร้านค้า**เฉพาะทาง**เครื่องใช้ไฟฟ้า,这是一家电器**专卖店**。,Zhè shì yī jiā diànqì **zhuānmàidiàn**.,นี่คือร้านค้า**เฉพาะทาง**เครื่องใช้ไฟฟ้า
chinese-essencial-in-communication-3-thai-sometimes,有时候,,yǒu shíhou,sometimes,บางครั้ง,🤷,我**有时候**会去公园散步。 (Wǒ **yǒushíhou** huì qù gōngyuán sànbù.) บางครั้งฉันจะไปเดินเล่นที่สวนสาธารณะ,我**有时候**会去公园散步。,Wǒ **yǒushíhou** huì qù gōngyuán sànbù.,บางครั้งฉันจะไปเดินเล่นที่สวนสาธารณะ
chinese-essencial-in-communication-3-thai-customize,定做,,dìngzuò,customize,สั่งทำ,🧵,我们可以为你**定做**一套西装。 (Wǒmen kěyǐ wéi nǐ **dìngzuò** yī tào xīzhuāng.) เราสามารถ**ตัดชุด**สูทให้คุณได้,我们可以为你**定做**一套西装。,Wǒmen kěyǐ wéi nǐ **dìngzuò** yī tào xīzhuāng.,เราสามารถ**ตัดชุด**สูทให้คุณได้
chinese-essencial-in-communication-3-thai-similar,差不多,,chàbuduō,similar,เกือบจะ,🆗,我的中文**差不多**。 (Wǒ de Zhōngwén **chàbuduō**.) ภาษาจีนของฉัน**เกือบจะ**ดีแล้ว,我的中文**差不多**。,Wǒ de Zhōngwén **chàbuduō**.,ภาษาจีนของฉัน**เกือบจะ**ดีแล้ว
chinese-essencial-in-communication-3-thai-to-deposit-money,存钱,,cún qián,to deposit money,เก็บเงิน,💰,我每个月都会**存钱**。 (Wǒ měi gè yuè dōu huì **cúnqián**.) ฉันจะ**เก็บเงิน**ทุกเดือน,我每个月都会**存钱**。,Wǒ měi gè yuè dōu huì **cúnqián**.,ฉันจะ**เก็บเงิน**ทุกเดือน
chinese-essencial-in-communication-3-thai-to-deposit,存,,cún,to deposit,เก็บ,🏦,请把钱**存**起来。 (Qǐng bǎ qián **cún** qǐlái.) กรุณา**เก็บ**เงินไว้,请把钱**存**起来。,Qǐng bǎ qián **cún** qǐlái.,กรุณา**เก็บ**เงินไว้
chinese-essencial-in-communication-3-thai-foreign-currency,外币,,wàibì,foreign currency,เงินตราต่างประเทศ,🌐,我需要兑换**外币**。 (Wǒ xūyào duìhuàn **wàibì**.) ฉันต้องการแลกเปลี่ยน**สกุลเงินต่างประเทศ**,我需要兑换**外币**。,Wǒ xūyào duìhuàn **wàibì**.,ฉันต้องการแลกเปลี่ยน**สกุลเงินต่างประเทศ**
chinese-essencial-in-communication-3-thai-bank-card,银行卡,,yínhángkǎ,bank card,บัตรเครดิต,💳,我需要一张**银行卡**。 (wǒ xū yào yī zhāng **yín háng kǎ**.) ฉันต้องการ**บัตรธนาคาร**,我需要一张**银行卡**。,wǒ xū yào yī zhāng **yín háng kǎ**.,ฉันต้องการ**บัตรธนาคาร**
chinese-essencial-in-communication-3-thai-to-manage,办,,bàn,to manage,ทำ,📝,"你**办**事，我放心。 (nǐ **bàn** shì, wǒ fàngxīn.) คุณ**จัดการ**เรื่องนี้ ผมวางใจ",你**办**事，我放心。,"nǐ **bàn** shì, wǒ fàngxīn.",คุณ**จัดการ**เรื่องนี้ ผมวางใจ
chinese-essencial-in-communication-3-thai-to-set-up,设置,,shèzhì,to set up,ตั้งค่า,⚙️,请**设置**一个闹钟。 (Qǐng **shèzhì** yīgè náozhōng.) กรุณา**ตั้ง**นาฬิกาปลุก,请**设置**一个闹钟。,Qǐng **shèzhì** yīgè náozhōng.,กรุณา**ตั้ง**นาฬิกาปลุก
chinese-essencial-in-communication-3-thai-to-withdraw-money,取钱,,qǔ qián,to withdraw money,ถอนเงิน,🏧,我要去银行**取钱**。 (Wǒ yào qù yínháng **qǔqián**.) ฉันจะไปธนาคารเพื่อ**ถอนเงิน**,我要去银行**取钱**。,Wǒ yào qù yínháng **qǔqián**.,ฉันจะไปธนาคารเพื่อ**ถอนเงิน**
chinese-essencial-in-communication-3-thai-overcoat,大衣,,dàyī,overcoat,เสื้อโค้ต,🧥,我穿上**大衣**去上班。 (wǒ chuān shàng **dàyī** qù shàngbān.) ฉันใส่**เสื้อโค้ท**ไปทำงาน,我穿上**大衣**去上班。,wǒ chuān shàng **dàyī** qù shàngbān.,ฉันใส่**เสื้อโค้ท**ไปทำงาน
chinese-essencial-in-communication-3-thai-to-suggest,建议,,jiànyì,to suggest,แนะนำ,🗣️,我有一个**建议**。 (Wǒ yǒu yí ge **jiànyì**.) ฉันมีข้อ**เสนอแนะ**,我有一个**建议**。,Wǒ yǒu yí ge **jiànyì**.,ฉันมีข้อ**เสนอแนะ**
chinese-essencial-in-communication-3-thai-youth,年轻人,,niánqīngrén,youth,คนหนุ่มสาว,🧑‍🤝‍🧑,我看到一群**年轻人**。 (wǒ kàn dào yī qún **niánqīngrén**.) ฉันเห็น**คนหนุ่มสาว**กลุ่มหนึ่ง,我看到一群**年轻人**。,wǒ kàn dào yī qún **niánqīngrén**.,ฉันเห็น**คนหนุ่มสาว**กลุ่มหนึ่ง
chinese-essencial-in-communication-3-thai-price,价钱,,jiàqián,price,ราคา,💲,这个苹果的**价钱**是多少？ (Zhège píngguǒ de **jiàqián** shì duōshao?) แอปเปิ้ลลูกนี้ราคาเท่าไหร่**คะ**?,这个苹果的**价钱**是多少？,Zhège píngguǒ de **jiàqián** shì duōshao?,แอปเปิ้ลลูกนี้ราคาเท่าไหร่**คะ**?
chinese-essencial-in-communication-3-thai-gift,礼物,,lǐwù,gift,ของขวัญ,🎁,我买了一个**礼物**送给她。 (Wǒ mǎi le yī gè **lǐwù** sòng gěi tā.) ฉันซื้อ**ของขวัญ**ให้เธอ,我买了一个**礼物**送给她。,Wǒ mǎi le yī gè **lǐwù** sòng gěi tā.,ฉันซื้อ**ของขวัญ**ให้เธอ
chinese-essencial-in-communication-3-thai-to-go-shopping,逛街,,guàngjiē,to go shopping,เดินช้อปปิ้ง,🛍️,我喜欢和朋友一起去**逛街**。 (Wǒ xǐhuān hé péngyǒu yīqǐ qù **guàngjiē**.) ฉันชอบไป**เดินช้อปปิ้ง**กับเพื่อน,我喜欢和朋友一起去**逛街**。,Wǒ xǐhuān hé péngyǒu yīqǐ qù **guàngjiē**.,ฉันชอบไป**เดินช้อปปิ้ง**กับเพื่อน
chinese-essencial-in-communication-3-thai-second-hand-store,旧货商店,,jiùhuò shāngdiàn,second-hand store,ร้านขายของเก่า,♻️,我喜欢去**旧货商店**淘旧物。 (wǒ xǐhuān qù **jiùhuò shāngdiàn** táo jiùwù.) ฉันชอบไปร้านขายของเก่าเพื่อหาของเก่า,我喜欢去**旧货商店**淘旧物。,wǒ xǐhuān qù **jiùhuò shāngdiàn** táo jiùwù.,ฉันชอบไปร้านขายของเก่าเพื่อหาของเก่า
chinese-essencial-in-communication-3-thai-to-stroll,逛,,guàng,to stroll,เดินเล่น,🚶,我喜欢**逛**街。 (Wǒ xǐhuān **guàng** jiē.) ฉันชอบ**เดินเล่น**,我喜欢**逛**街。,Wǒ xǐhuān **guàng** jiē.,ฉันชอบ**เดินเล่น**
chinese-essencial-in-communication-3-thai-old,老,,lǎo,old,แก่,👴,他是一个**老**人。 (Tā shì yī gè **lǎo** rén.) เขาเป็นคน**แก่**,他是一个**老**人。,Tā shì yī gè **lǎo** rén.,เขาเป็นคน**แก่**
chinese-essencial-in-communication-3-thai-record,唱片,,chàngpiàn,record,แผ่นเสียง,💿,我喜欢听**唱片**。 (Wǒ xǐhuān tīng **chàngpiàn**.) ฉันชอบฟัง**แผ่นเสียง**,我喜欢听**唱片**。,Wǒ xǐhuān tīng **chàngpiàn**.,ฉันชอบฟัง**แผ่นเสียง**
chinese-essencial-in-communication-3-thai-old-fashioned,老式,,lǎoshì,old-fashioned,เก่า,🕰️,这是一款很**老式**的收音机。 (Zhè shì yī kuǎn hěn **lǎoshì** de shōuyīnjī.) นี่คือวิทยุที่**ล้าสมัย**มาก,这是一款很**老式**的收音机。,Zhè shì yī kuǎn hěn **lǎoshì** de shōuyīnjī.,นี่คือวิทยุที่**ล้าสมัย**มาก
chinese-essencial-in-communication-3-thai-camera,照相机,,zhàoxiàngjī,camera,กล้องถ่ายรูป,📸,我有一个**照相机**。 (wǒ yǒu yí gè **zhàoxiàngjī**。) ฉันมี**กล้องถ่ายรูป**,我有一个**照相机**。,wǒ yǒu yí gè **zhàoxiàngjī**。,ฉันมี**กล้องถ่ายรูป**
chinese-essencial-in-communication-3-thai-complexion-face,脸色,,liǎnsè,"complexion, face",สีหน้า,😔,他的**脸色**苍白。 (tā de **liǎnsè** cāngbái.) สีหน้าของเขา**ซีด**ขาว,他的**脸色**苍白。,tā de **liǎnsè** cāngbái.,สีหน้าของเขา**ซีด**ขาว
chinese-essencial-in-communication-3-thai-to-catch-a-cold,感冒,,gǎnmào,to catch a cold,เป็นหวัด,🤧,我**感冒**了。 (wǒ **gǎnmào** le.) ฉัน**เป็นหวัด**,我**感冒**了。,wǒ **gǎnmào** le.,ฉัน**เป็นหวัด**
chinese-essencial-in-communication-3-thai-serious,严重,,yánzhòng,serious,ร้ายแรง,⚠️,这个问题很**严重**。 (Zhè ge wèn tí hěn **yán zhòng**.) ปัญหานี้**ร้ายแรง**มาก,这个问题很**严重**。,Zhè ge wèn tí hěn **yán zhòng**.,ปัญหานี้**ร้ายแรง**มาก
chinese-essencial-in-communication-3-thai-throat,嗓子,,sǎngzi,throat,ลำคอ,🗣️,他**嗓子**疼。 (Tā **sǎngzi** téng.) เขาเจ็บ**คอ**,他**嗓子**疼。,Tā **sǎngzi** téng.,เขาเจ็บ**คอ**
chinese-essencial-in-communication-3-thai-hurt,疼,,téng,hurt,ปวด,🤕,我腿很**疼**。 (wǒ tuǐ hěn **téng**.) ขาของฉันเจ็บมาก**เจ็บ**,我腿很**疼**。,wǒ tuǐ hěn **téng**.,ขาของฉันเจ็บมาก**เจ็บ**
chinese-essencial-in-communication-3-thai-to-have-a-fever,发烧,,fāshāo,to have a fever,มีไข้,🔥,他**发烧**了。 (tā **fāshāo** le.) เขา**เป็นไข้**,他**发烧**了。,tā **fāshāo** le.,เขา**เป็นไข้**
chinese-essencial-in-communication-3-thai-to-register,挂号,,guà hào,to register,ลงทะเบียน,📋,请您先去**挂号**。 (Qǐng nín xiān qù **guàhào**.) กรุณาไปที่แผนก**ลงทะเบียน**ก่อน,请您先去**挂号**。,Qǐng nín xiān qù **guàhào**.,กรุณาไปที่แผนก**ลงทะเบียน**ก่อน
chinese-essencial-in-communication-3-thai-to-register,挂,,guà,to register,แขวน,🏷️,我把衣服**挂**在衣架上。 (Wǒ bǎ yīfu **guà** zài yījià shàng.) ฉัน**แขวน**เสื้อผ้าบนไม้แขวนเสื้อ,我把衣服**挂**在衣架上。,Wǒ bǎ yīfu **guà** zài yījià shàng.,ฉัน**แขวน**เสื้อผ้าบนไม้แขวนเสื้อ
chinese-essencial-in-communication-3-thai-section,科,,kē,section,แผนก,🏥,你主修什么**科**？ (nǐ zhǔ xiū shén me **kē**?) คุณเรียนวิชาเอกอะไร**คะ**?,你主修什么**科**？,nǐ zhǔ xiū shén me **kē**?,คุณเรียนวิชาเอกอะไร**คะ**?
chinese-essencial-in-communication-3-thai-internal-medicine,内科,,nèikē,internal medicine,อายุรกรรม,🩺,他是**内科**医生。 (Tā shì **nèikē** yīshēng.) เขาเป็นแพทย์**อายุรศาสตร์**,他是**内科**医生。,Tā shì **nèikē** yīshēng.,เขาเป็นแพทย์**อายุรศาสตร์**
chinese-essencial-in-communication-3-thai-surgical-department,外科,,wàikē,surgical department,ศัลยกรรม,🔪,他是一名**外科**医生。 (Tā shì yī míng **wàikē** yīshēng.) เขาเป็นหมอ**ศัลยแพทย์**,他是一名**外科**医生。,Tā shì yī míng **wàikē** yīshēng.,เขาเป็นหมอ**ศัลยแพทย์**
chinese-essencial-in-communication-3-thai-head,头,,tóu,head,หัว,🧠,我的**头**很痛。 (wǒ de **tóu** hěn tòng.) ฉันปวด**หัว**มาก,我的**头**很痛。,wǒ de **tóu** hěn tòng.,ฉันปวด**หัว**มาก
chinese-essencial-in-communication-3-thai-to-cough,咳嗽,,késou,to cough,ไอ,🤧,我**咳嗽**了。 (Wǒ **késou** le.) ฉัน**ไอ**,我**咳嗽**了。,Wǒ **késou** le.,ฉัน**ไอ**
chinese-essencial-in-communication-3-thai-to-measure,量,,liáng,to measure,ปริมาณ,📏,你的衣服有**量**吗？ (nǐ de yīfu yǒu **liàng** ma?) เสื้อผ้าของคุณมี**ปริมาณ**ไหม,你的衣服有**量**吗？,nǐ de yīfu yǒu **liàng** ma?,เสื้อผ้าของคุณมี**ปริมาณ**ไหม
chinese-essencial-in-communication-3-thai-temperature,体温,,tǐwēn,temperature,อุณหภูมิร่างกาย,🌡️,量一下**体温**。 (liáng yī xià **tǐwēn**.) วัด**อุณหภูมิ**หน่อย,量一下**体温**。,liáng yī xià **tǐwēn**.,วัด**อุณหภูมิ**หน่อย
chinese-essencial-in-communication-3-thai-to-take-medicine,吃药,,chī yào,to take medicine,กินยา,💊,我需要**吃药**。 (wǒ xūyào **chīyào**.) ฉันต้อง**กินยา**,我需要**吃药**。,wǒ xūyào **chīyào**.,ฉันต้อง**กินยา**
chinese-essencial-in-communication-3-thai-medicine,药,,yào,medicine,ยา,🧪,你吃**药**了吗？ (Nǐ chī **yào** le ma?) คุณกิน**ยา**หรือยัง?,你吃**药**了吗？,Nǐ chī **yào** le ma?,คุณกิน**ยา**หรือยัง?
chinese-essencial-in-communication-3-thai-measure-word,片,,piàn,(measure word),ชิ้น,⬜,给我一片西瓜。 (Gěi wǒ yī piàn **xīguā**.) ขอ**แตงโม**ชิ้นหนึ่ง,给我一片西瓜。,Gěi wǒ yī piàn **xīguā**.,ขอ**แตงโม**ชิ้นหนึ่ง
chinese-essencial-in-communication-3-thai-antiphlogistic-drug,消炎药,,xiāoyán yào,antiphlogistic drug,ยาแก้อักเสบ,🛡️,我需要**消炎药**。 (Wǒ xūyào **xiāoyányào**.) ฉันต้องการ**ยาแก้อักเสบ**,我需要**消炎药**。,Wǒ xūyào **xiāoyányào**.,ฉันต้องการ**ยาแก้อักเสบ**
chinese-essencial-in-communication-3-thai-to-get-inflamed,发炎,,fāyán,to get inflamed,อักเสบ,🔴,我的喉咙**发炎**了。 (Wǒ de hóulóng **fāyán** le.) เจ็บคอของฉัน**อักเสบ**แล้ว,我的喉咙**发炎**了。,Wǒ de hóulóng **fāyán** le.,เจ็บคอของฉัน**อักเสบ**แล้ว
chinese-essencial-in-communication-3-thai-effect,效果,,xiàoguǒ,effect,"ผล, อิทธิพล, ประสิทธิภาพ",✨,这个药的**效果**很好。 (Zhège yào de **xiàoguǒ** hěn hǎo.) ยาตัวนี้มี**ประสิทธิภาพ**ดีมาก,这个药的**效果**很好。,Zhège yào de **xiàoguǒ** hěn hǎo.,ยาตัวนี้มี**ประสิทธิภาพ**ดีมาก
chinese-essencial-in-communication-3-thai-western-medicine,西药,,xīyào,Western medicine,ยาฝรั่ง,💊,医生开了**西药**给我。 (Yīshēng kāile **xīyào** gěi wǒ.) หมอสั่ง**ยาแผนปัจจุบัน**ให้ฉัน,医生开了**西药**给我。,Yīshēng kāile **xīyào** gěi wǒ.,หมอสั่ง**ยาแผนปัจจุบัน**ให้ฉัน
chinese-essencial-in-communication-3-thai-traditional-chinese-medicine,中药,,zhōngyào,traditional Chinese medicine,ยาจีน,🌿,今天是一个**阴天**。 (Jīntiān shì yí ge **yīntiān**.) วันนี้เป็นวัน**ที่มืดครึ้ม**,今天是一个**阴天**。,Jīntiān shì yí ge **yīntiān**.,วันนี้เป็นวัน**ที่มืดครึ้ม**
chinese-essencial-in-communication-3-thai-measure-word,粒,,lì,(measure word),เม็ด,🟡,这瓶水里有**粒**沙子。 (Zhè píng shuǐ lǐ yǒu **lì** shāzi.) ในขวดน้ำนี้มีทรายอยู่เป็น**เม็ด**,这瓶水里有**粒**沙子。,Zhè píng shuǐ lǐ yǒu **lì** shāzi.,ในขวดน้ำนี้มีทรายอยู่เป็น**เม็ด**
chinese-essencial-in-communication-3-thai-before-meal,饭前,,fàn qián,before meal,ก่อนอาหาร,🍽️,我**饭前**洗手。 (wǒ **fànqián** xǐshǒu.) ฉันล้างมือก่อน**อาหาร**,我**饭前**洗手。,wǒ **fànqián** xǐshǒu.,ฉันล้างมือก่อน**อาหาร**
chinese-essencial-in-communication-3-thai-please-come-in,请进,,qǐng jìn,please come in,เชิญเข้ามา,🚪,"**请进**，请坐。 (**Qǐng jìn**, qǐng zuò.) **เชิญเข้ามา**นั่งได้เลย",**请进**，请坐。,"**Qǐng jìn**, qǐng zuò.",**เชิญเข้ามา**นั่งได้เลย
chinese-essencial-in-communication-3-thai-come-into,进,,jìn,come into,เข้า,➡️,我**进**去。 (wǒ **jìn** qù.) ฉัน**เข้าไป**,我**进**去。,wǒ **jìn** qù.,ฉัน**เข้าไป**
chinese-essencial-in-communication-3-thai-to-clear-up,收拾,,shōushi,to clear up,จัดของ,🧹,请帮我把房间**收拾**一下。 (Qǐng bāng wǒ bǎ fángjiān **shōushi** yīxià.) ช่วยจัดห้องให้ฉันหน่อย,请帮我把房间**收拾**一下。,Qǐng bāng wǒ bǎ fángjiān **shōushi** yīxià.,ช่วยจัดห้องให้ฉันหน่อย
chinese-essencial-in-communication-3-thai-to-wash,洗,,xǐ,to wash,ล้าง,🧼,我喜欢**洗**澡。 (Wǒ xǐhuān **xǐ** zǎo.) ฉันชอบอาบ**น้ำ**,我喜欢**洗**澡。,Wǒ xǐhuān **xǐ** zǎo.,ฉันชอบอาบ**น้ำ**
chinese-essencial-in-communication-3-thai-to-sweep,打扫,,dǎsǎo,to sweep,ทำความสะอาด,🧽,我每天**打扫**房间。 (Wǒ měitiān **dǎsǎo** fángjiān.) ฉัน**ทำความสะอาด**ห้องทุกวัน,我每天**打扫**房间。,Wǒ měitiān **dǎsǎo** fángjiān.,ฉัน**ทำความสะอาด**ห้องทุกวัน
chinese-essencial-in-communication-3-thai-to-wipe,擦,,cā,to wipe,เช็ด,🧤,我**擦**干净了桌子。 (Wǒ **cā** gānjìng le zhuōzi.) ฉัน**เช็ด**โต๊ะสะอาดแล้ว,我**擦**干净了桌子。,Wǒ **cā** gānjìng le zhuōzi.,ฉัน**เช็ด**โต๊ะสะอาดแล้ว
chinese-essencial-in-communication-3-thai-floor,地板,,dìbǎn,floor,พื้น,🏠,我擦**地板**。 (Wǒ cā **dìbǎn**.) ฉันเช็ด**พื้น**,我擦**地板**。,Wǒ cā **dìbǎn**.,ฉันเช็ด**พื้น**
chinese-essencial-in-communication-3-thai-to-take-a-photograph,摄影,,shèyǐng,to take a photograph,การถ่ายภาพ,📷,我喜欢**摄影**。 (Wǒ xǐhuān **shèyǐng**.) ฉันชอบ**ถ่ายภาพ**,我喜欢**摄影**。,Wǒ xǐhuān **shèyǐng**.,ฉันชอบ**ถ่ายภาพ**
chinese-essencial-in-communication-3-thai-to-play-tennis,打网球,,dǎ wǎngqiú,to play tennis,เล่นเทนนิส,🎾,我喜欢**打网球**。 (wǒ xǐhuān **dǎ wǎngqiú**.) ฉันชอบ**เล่นเทนนิส**,我喜欢**打网球**。,wǒ xǐhuān **dǎ wǎngqiú**.,ฉันชอบ**เล่นเทนนิส**
chinese-essencial-in-communication-3-thai-to-play,打,,dǎ,to play,ตี,🏏,他喜欢**打**篮球。 (Tā xǐhuan **dǎ** lánqiú.) เขาชอบ**เล่น**บาสเกตบอล,他喜欢**打**篮球。,Tā xǐhuan **dǎ** lánqiú.,เขาชอบ**เล่น**บาสเกตบอล
chinese-essencial-in-communication-3-thai-tennis,网球,,wǎngqiú,tennis,เทนนิส,🎽,我喜欢打**网球**。 (Wǒ xǐhuān dǎ **wǎngqiú**.) ฉันชอบเล่น**เทนนิส**,我喜欢打**网球**。,Wǒ xǐhuān dǎ **wǎngqiú**.,ฉันชอบเล่น**เทนนิส**
chinese-essencial-in-communication-3-thai-sport,运动,,yùndòng,sport,การออกกำลังกาย,🏅,他喜欢每天做**运动**。 (Tā xǐhuān měitiān zuò **yùndòng**.) เขาชอบออกกำลังกายทุกวัน,他喜欢每天做**运动**。,Tā xǐhuān měitiān zuò **yùndòng**.,เขาชอบออกกำลังกายทุกวัน
chinese-essencial-in-communication-3-thai-football,足球,,zúqiú,football,ฟุตบอล,⚽,我喜欢踢**足球**。 (Wǒ xǐhuān tī **zúqiú**.) ฉันชอบเตะ**ฟุตบอล**,我喜欢踢**足球**。,Wǒ xǐhuān tī **zúqiú**.,ฉันชอบเตะ**ฟุตบอล**
chinese-essencial-in-communication-3-thai-often,经常,,jīngcháng,often,บ่อยๆ,🔄,我**经常**去图书馆。 (wǒ **jīngcháng** qù túshūguǎn.) ฉันไปห้องสมุดบ่อยๆ,我**经常**去图书馆。,wǒ **jīngcháng** qù túshūguǎn.,ฉันไปห้องสมุดบ่อยๆ
chinese-essencial-in-communication-3-thai-to-play-football,踢足球,,tī zúqiú,to play football,เตะฟุตบอล,🥅,我喜欢**踢足球**。 (Wǒ xǐhuān **tī zúqiú**.) ฉันชอบ**เตะฟุตบอล**,我喜欢**踢足球**。,Wǒ xǐhuān **tī zúqiú**.,ฉันชอบ**เตะฟุตบอล**
chinese-essencial-in-communication-3-thai-to-kick,踢,,tī,to kick,เตะ,🦵,我喜欢**踢**足球。 (Wǒ xǐhuān **tī** zúqiú.) ฉันชอบ**เตะ**ฟุตบอล,我喜欢**踢**足球。,Wǒ xǐhuān **tī** zúqiú.,ฉันชอบ**เตะ**ฟุตบอล
chinese-essencial-in-communication-3-thai-ball-game,球赛,,qiúsài,ball game,การแข่งขันฟุตบอล,🏟️,我喜欢看**球赛**。 (Wǒ xǐhuān kàn **qiúsài**.) ฉันชอบดู**การแข่งขันกีฬา**,我喜欢看**球赛**。,Wǒ xǐhuān kàn **qiúsài**.,ฉันชอบดู**การแข่งขันกีฬา**
chinese-essencial-in-communication-3-thai-movie,电影,,diànyǐng,movie,ภาพยนตร์,🎬,我喜欢看**电影**。 (Wǒ xǐhuān kàn **diànyǐng**.) ฉันชอบดู**หนัง**,我喜欢看**电影**。,Wǒ xǐhuān kàn **diànyǐng**.,ฉันชอบดู**หนัง**
